{
  "schema_version": "0.1.0",
  "processing": {
    "run_id": "run_bf4c81a0f117",
    "processed_at": "2026-07-03T16:00:48.987154+00:00",
    "model": "llama-3.3-70b-versatile",
    "prompt_version": "agoraloi_prompt_v0.2",
    "status": "automatic",
    "global_confidence": 0.8,
    "warnings": []
  },
  "raw_source": {
    "id": "an_qe_QANR5L17QE11735",
    "type": "written_question",
    "institution": "assemblee_nationale",
    "date": "2025-12-16",
    "title": "Généralisation des directives anticipées via le mariage",
    "url": "https://questions.assemblee-nationale.fr/q17/17-11735QE.htm",
    "official_identifier": "QANR5L17QE11735",
    "original_text": "Question : M. Christophe Blanchet interroge Mme la ministre de la santé, des familles, de l'autonomie et des personnes handicapées sur le faible recours aux directives anticipées et les opportunités de sensibilisation lors des démarches d'état civil. Alors que la loi Claeys-Leonetti de 2016 a renforcé ce droit, une minorité de Français a formellement rédigé ses directives, laissant souvent les familles et le corps médical dans l'incertitude lors de fins de vie difficiles. Or l'officier d'état civil joue un rôle central lors des moments clés de la vie citoyenne. La constitution du dossier de mariage ou de PACS, moment de réflexion sur la protection mutuelle des époux, constitue une opportunité administrative unique et peu coûteuse pour aborder ce sujet. Il ne s'agit pas d'imposer, mais de systématiser l'information. Il lui demande si le Gouvernement envisage d'intégrer, lors des démarches préalables au mariage ou au PACS en mairie, la remise systématique d'un formulaire ou d'une notice explicative sur les directives anticipées et la désignation de la personne de confiance, afin de normaliser cette démarche de prévoyance au sein des familles.",
    "metadata": {
      "legislature": "17",
      "numero": "11735",
      "rubrique": "fin de vie et soins palliatifs",
      "code_cloture": ""
    }
  },
  "extracted_traces": [
    {
      "id": "trace_fin_vie_001",
      "source_id": "an_qe_QANR5L17QE11735",
      "summary": "Une question écrite demande au Gouvernement d'envisager l'intégration de la remise systématique d'un formulaire ou d'une notice explicative sur les directives anticipées lors des démarches préalables au mariage ou au PACS.",
      "argument_role": "evaluation_request",
      "position": "neutral",
      "public_policy_domains": [
        "sante"
      ],
      "affected_publics": [
        "patients en fin de vie",
        "familles",
        "personnes handicapées"
      ],
      "issues": [
        "directives anticipées",
        "sensibilisation"
      ],
      "evidence": [
        {
          "quote": "la loi Claeys-Leonetti de 2016 a renforcé ce droit, une minorité de Français a formellement rédigé ses directives",
          "source_url": "https://questions.assemblee-nationale.fr/q17/17-11735QE.htm"
        }
      ],
      "confidence": 0.8,
      "validation_status": "automatic"
    }
  ],
  "taxonomy_links": [
    {
      "domain_id": "sante",
      "domain_label": "Santé",
      "subtheme_id": "droits-patients-fin-vie",
      "subtheme_label": "Droits des patients et fin de vie",
      "subject_id": "aide-a-mourir",
      "subject_title": "Aide à mourir",
      "link_strength": "weak",
      "rationale": "La question porte sur les directives anticipées, qui sont liées aux droits des patients en fin de vie.",
      "confidence": 0.7
    }
  ],
  "subject_updates": [
    {
      "subject_id": "aide-a-mourir",
      "subject_title": "Aide à mourir",
      "summary": "Résumé mis à jour du sujet : les directives anticipées sont un aspect important des droits des patients en fin de vie.",
      "context_update": "La question écrite souligne l'importance de la sensibilisation aux directives anticipées lors des démarches préalables au mariage ou au PACS.",
      "timeline_events": [
        {
          "date": "2025-12-16",
          "type": "Question écrite",
          "title": "Généralisation des directives anticipées via le mariage",
          "summary": "Une question écrite demande au Gouvernement d'envisager l'intégration de la remise systématique d'un formulaire ou d'une notice explicative sur les directives anticipées lors des démarches préalables au mariage ou au PACS.",
          "url": "https://questions.assemblee-nationale.fr/q17/17-11735QE.htm"
        }
      ],
      "actors": [
        {
          "id": "acteur_christophe_blanchet",
          "name": "Christophe Blanchet",
          "type": "elected_official",
          "role": "Député, auteur de la question écrite",
          "party": "Non renseigné",
          "photo_url": "",
          "stance_summary": "Demande au Gouvernement d'envisager l'intégration de la remise systématique d'un formulaire ou d'une notice explicative sur les directives anticipées lors des démarches préalables au mariage ou au PACS."
        }
      ],
      "argument_clusters": [
        {
          "id": "cluster_directives_anticipées",
          "axis": "directives-anticipées",
          "position": "neutral",
          "label": "Sensibilisation aux directives anticipées",
          "summary": "La question écrite souligne l'importance de la sensibilisation aux directives anticipées lors des démarches préalables au mariage ou au PACS.",
          "actors": [
            {
              "actor_id": "acteur_christophe_blanchet",
              "quote": "la loi Claeys-Leonetti de 2016 a renforcé ce droit, une minorité de Français a formellement rédigé ses directives",
              "quote_source": "Question écrite n°11735, 17e législature",
              "stance_summary": "Demande au Gouvernement d'envisager l'intégration de la remise systématique d'un formulaire ou d'une notice explicative sur les directives anticipées lors des démarches préalables au mariage ou au PACS.",
              "evidence": [
                {
                  "quote": "la loi Claeys-Leonetti de 2016 a renforcé ce droit, une minorité de Français a formellement rédigé ses directives",
                  "source_url": "https://questions.assemblee-nationale.fr/q17/17-11735QE.htm"
                }
              ]
            }
          ]
        }
      ]
    }
  ]
}